{
  "schema_proveniencia_medicao": 1,
  "modo": "entrada_congelada",
  "entrada_id": "dee03c387dbdf6b04b79cd41f063bc451e8537380a369250c579d9c8d43e1cce",
  "status_entrada": "valida",
  "conclusao_reprodutivel_permitida": true,
  "fonte": {
    "perfil": "codex_jsonl_v1",
    "corte_bytes": 2098214,
    "sha256": "8be6e5f5068f3dbf21abdb02339f7d5499b854abdc0efd1d744b8e5e9965b55f"
  },
  "contrato": {
    "sha256": "b707158338990fd31a828208d48fb8a02e7b2c5622ecb1adbea35907c004e7fe",
    "versao": "1.0.0"
  },
  "snapshots": {
    "adjudicacoes": {
      "estado": "presente",
      "sha256": "2f9d1457f3ef77c079f984d476e172a5a4af00de8b687e83c8da72054660ab24",
      "formato": "json"
    },
    "baseline": {
      "estado": "presente",
      "sha256": "9a49c77c006e765d675021bfdf502f9bd695fef89afd70ac9b734275dd266c8c",
      "formato": "json"
    },
    "catalogo": {
      "estado": "presente",
      "sha256": "01d2ffec77341f7ea1c458ef737515350d904d9f7c56f07a43bae15405b99da7",
      "formato": "json"
    },
    "guardrails": {
      "estado": "presente",
      "sha256": "3063ce7638e3409f932b489b65ec7558f6d9424a26fab5e5f35b5e5a085c7c08",
      "formato": "json"
    },
    "interacoes": {
      "estado": "presente",
      "sha256": "b56ec45998ec8d9a6a474922b643198976d641f4ce1a8195d5625b0754935d20",
      "formato": "json"
    },
    "metas": {
      "estado": "presente",
      "sha256": "34299a003f6f0beba620993e8d0af8ade8350f38899c5fac4855e6ed177de0b2",
      "formato": "json"
    },
    "releases": {
      "estado": "presente",
      "sha256": "c88037a03b1f61653b114201b8d7f05f9f550de34fb6bccba0479211fe82d010",
      "formato": "json"
    },
    "series": {
      "estado": "presente",
      "sha256": "f034db39199328f5fd56af669c18a6f78712b0bd97095db991ff9e794052333b",
      "formato": "json"
    },
    "validade": {
      "estado": "presente",
      "sha256": "7445868e3c4d530ac5cdc6f9acd7941d5d8cc585872d269245fc049cd1976ace",
      "formato": "json"
    }
  },
  "contratos_modulos": {
    "adversarial_operations": {
      "estado": "presente",
      "sha256": "0187095dc892916c1ff8f00773edf633cb9527b5f2691a361edcd793e04ad599"
    },
    "canonical_quest_integration": {
      "estado": "presente",
      "sha256": "98d4a9adc36704778b2ad2ca3ef2d1f82dabe797c12b0567264ced787382bc4e"
    },
    "causal_narrative_routing": {
      "estado": "presente",
      "sha256": "3bfe8176d8bd2998dd1d6c824e2041186c50150e97f778497e49f8dce0fa75f4"
    },
    "context_and_memory": {
      "estado": "presente",
      "sha256": "16721ee9da88a5dbc94807239cbf84b846ac34e191afe987a378297678d58f35"
    },
    "narrative_delivery": {
      "estado": "presente",
      "sha256": "ad691aa36766b5e9c145a6032b52c2824d6c72507f7cf00c13fea40d2960ddd2"
    },
    "npc_continuity_and_social_behavior": {
      "estado": "presente",
      "sha256": "c03ab392dfe0a63fa0be7f2bff0d8ac36eaaabf8a2b46da0fc2be696d862348c"
    },
    "rules_and_character_state": {
      "estado": "presente",
      "sha256": "2b714c7c059310ad2769bc825ce2d3739a085e17560b747ed11ce156ac6a698e"
    },
    "scene_world_projection": {
      "estado": "presente",
      "sha256": "65688bad372c027942e74324b31a1872336c22adbf8c3b859c5cf33bcaf6b0f1"
    },
    "sidequest_authoring": {
      "estado": "presente",
      "sha256": "2b54d9349bda3b80343fda09b46e110bedd7710a4e9809b70ea1f0f6075cd2ed"
    },
    "sidequest_lifecycle": {
      "estado": "presente",
      "sha256": "9cc2464b66b051801c01f71fe9efe1fe6727b3e98c7a6328f1bd69e76ff84ff5"
    },
    "turn_and_session_orchestration": {
      "estado": "presente",
      "sha256": "de837419a53abdb5373c7749a3c187af90f9dcca19f1520e8d8c7483b8ffb0a3"
    },
    "world_boundary_resolution": {
      "estado": "presente",
      "sha256": "8d1486f3a3d9a43856b48063aa2858536f928177578fe56bcac0a2eb83d93cc6"
    }
  },
  "codigo_sha256": {
    "evaluation/dashboard/app.js": "8a36cbc0200b0436dd486dd21678b9f62ff83ccfaccc0692af2a832701003b41",
    "evaluation/dashboard/index.html": "ef37fab6d3421b89c74f201ba67df9faeb179113c53e9d252e919fd633c7a831",
    "evaluation/dashboard/styles.css": "353c71069c300d5e35a953330385dd2ced881e9ea427128971c4df621ed51c55",
    "ferramentas/__init__.py": "ab9d17638ccaacff340530a932f74c723966732ef7c4869929671e39b75c453a",
    "ferramentas/_agentes_leves_nv17.py": "54bbb575fef9c2375c585982c27873ae82abeaa52ea937f5d4542223572d017e",
    "ferramentas/_analisar_rollout_core.py": "c6ab7c27f89d340b0a36a2d3cd4d8b9fb0333947860948c413c43648951b0834",
    "ferramentas/_cena_mundo_core.py": "95661d1811a860a43fc9af436e704fa1d3131b293f17957a1af8c290e6161483",
    "ferramentas/_checkpoint_nv17.py": "12d73ffcfa634a77bad0bd0c5b7a46ad302ebaa45bd32f2da8c6b5adc45ad780",
    "ferramentas/_compromissos_nv17.py": "47163362da3a65bdd929b23bf1d9b657476e898d68d28690b015c8804198e65e",
    "ferramentas/_condicoes_mundo_task34.py": "67217526b1a4587321e9104b3736c146309ece49b6196f1dee4faf1593b6039b",
    "ferramentas/_consolidar_core.py": "a42c1cdd44d0fd3d07fed2be533fe4b534e59f8442e64d66b9b8bc4043568aba",
    "ferramentas/_consolidar_nv19.py": "4a704652f36310c3a08154fc952ba3bd7fc4879677652a9751654ed25fa92f9f",
    "ferramentas/_consolidar_nv20.py": "d049717dea7b85c6a30b8929eb5b3828211caf6e2fc8f8d893f6fffd5dc64782",
    "ferramentas/_contatos_sociais_nv18.py": "2095284e1aae27d01a74d74956a488d7946931ead5537da0bf4dae022cd6f3aa",
    "ferramentas/_cronica_nv14.py": "7f23ce886d7609d42ed80d78c4a88c9767bb1f0a00d3e3c72dc5d56deb010660",
    "ferramentas/_cronica_turn_core.py": "feb3a7e795e1c68b85bc43b8e6e2c616a62639de35132448b23ef0e2480f674c",
    "ferramentas/_endpoints_core.py": "8c1cc6ef382a5271dc318c9f592a4a6355eada33d7fd984507193681ec9ad330",
    "ferramentas/_microeventos_transito_nv20.py": "dfe33a0a3cf1d07da1df2e89c42402d6cbad9f55627be30e82e82a2def2be4ef",
    "ferramentas/_module_facade.py": "f64b535316515da144914838a058ae7059ea7b904104e2dce7ecd8347d9fd4d6",
    "ferramentas/_permanencia_espacial_core.py": "a662f8b7597e852cf08294b4d5e2dd993ef122b82ff4e434ebe1181bcf90693d",
    "ferramentas/_planos_personagens_nv18.py": "fa3d17179441a3b1239a283b47d009017f0c8c7daa9da5559a2f579970e1503d",
    "ferramentas/_planos_personagens_nv19.py": "e85f588e4577be94cc37577c9abed7cbb684e8f64c176e663421cb72aba30c96",
    "ferramentas/_planos_personagens_nv20.py": "f6e74cc5730617be39f2f06c678b4a390dbd7b141474ac5d769bb1de4b5183b6",
    "ferramentas/_preflight_nv19.py": "e36e68d90cf9b186491ab7339ecdb1a19fc548fcd68fb299b8285905fb589751",
    "ferramentas/_preflight_nv21.py": "23ee73a59d369305ea610be7ac2f5f74066b74853ad7260ae6f0ee82d9b4dd80",
    "ferramentas/_preflight_nv22.py": "2a8d899c59c65d014a0b20f2a72bceb4718e35a7e25944d0dfa7fc278656e53f",
    "ferramentas/_progressao_sidequests_task45_base.py": "de68a52010577bbcd464bd4fc1ff431c7c851f2e9a65db01e5694004c1d64285",
    "ferramentas/_rastros_core.py": "1ad30979680a90f184ff74f802b9c58ea1928ca9619b2f7ddfeeb168eeffac32",
    "ferramentas/_rolar_dados_core.py": "769870955f258f50451696a5910f4ab008fa0c93c5d5eb98c106ae6e5c19a08e",
    "ferramentas/_sidequest_facade.py": "dec0b1a18106ddbeb90dfb17a91e7f243410cdb330c732b367c8924fd92056f4",
    "ferramentas/_sidequests_canonicas_task32.py": "f33cfdc2c7853fab7b0ae446b18b335982e69717583c2b17cc38289a75e9ae98",
    "ferramentas/_transacoes_core.py": "e6dfa25eecfd34fa77dbc8d504e69e64719945544000a1bd6c1ed715d6d8485f",
    "ferramentas/_transacoes_nv19.py": "26612df18c332708740367aa3b0b888b96e651747ef9163c6fbe5efbeda527fe",
    "ferramentas/_transacoes_nv20.py": "34119813c8e3d9c51e76bbacb6ef795ef7019ac87fb28b7ea9d29656d35b79d4",
    "ferramentas/aceitacao_modular_v2.py": "ddfaec0843f0785cfc5c3ce8bb8ff0551c89c3f8ac13f23af56ee73a4564a702",
    "ferramentas/aceitacao_vivacidade.py": "89272afd6cbef9dc0151cbd28f70051658462caaf2b93d2f818a6f612185bdac",
    "ferramentas/acionamentos_leves.py": "fb8968e113af6c699770b81e9e4aecba43480cf84c0227b91054b845956102a4",
    "ferramentas/adversarial_operations.py": "b39ec540d1b4505e17626a099368349efc62a2d229e3d8a5026089be6e3b2d61",
    "ferramentas/adversarios.py": "2abd537eab3d80f665e36d9f39102455c6301116b8edec0d57777edfeb53f807",
    "ferramentas/agentes.py": "c3c5d3edb65e2e2b21fe0d3dc22524c7ced5b7605ca606fc0a48f57afe66a961",
    "ferramentas/agentes_leves.py": "453cbebccdf9a236f33afe9de0e4574fd2d31aff1e1c67ac73449029e2ec33a1",
    "ferramentas/aliados_contextuais.py": "08f01f7184f3e4bf1e7945f5487774af2ea0e84f19512bcd00d718b240aed33e",
    "ferramentas/ameacas.py": "c473bc4fed561bee96c91f36eb01e760c2d63e432470150ee259bf700ffb8d36",
    "ferramentas/analisar-rollout.py": "5144f690005884acde1b908dc27755f70eae8d35c368b360fb7516c53c7a110c",
    "ferramentas/apresentacao_avaliacao.py": "e778b0ed133c3420ac0f76dc2b07b64bca8c65c8a507db068d488a5860491cd1",
    "ferramentas/arco_mundo.py": "8d268171d144be7b166795b07302bb42f8575795ec5794d638953294aff0b981",
    "ferramentas/arcos.py": "a4410d8ecb92ae3e9834366798fd884440f66313b9cf6724376d7700d41989ca",
    "ferramentas/atividades_modulares.py": "a9497866eea4604d836355d24f4170c9ccc36e5921e4056d2ffce06683c18e0e",
    "ferramentas/auditar-testes.py": "b14565aa68a41c2cd4709228f59bb55a85266ef109a34982d3fbdb6f25628685",
    "ferramentas/auditoria-final.py": "5a2bce00e2ee053695bb380bd73620f8e51821c322932f1bfd11df10887381f4",
    "ferramentas/autonomia_juppongatana.py": "31bc9b1ace682dfdb6f7ba2351121a6b180b8a35758ac31cb2dd35c83a7412d8",
    "ferramentas/barreira_mundo.py": "43e095f555b6bf7d000fb22a1e0ce28da837bdad05ed83f14fba9ec619978b97",
    "ferramentas/benchmark-rollouts.py": "8272c2ee8ab34a1332624dc284f14938992510144a284feb9e86b629421b59a4",
    "ferramentas/benchmark_narrativo.py": "dbc7b0025eb0b1e54d314c2e3ca183de976134dedeedb134eeb08445f1a40bb4",
    "ferramentas/benchmark_sondas.py": "a64a1a583951b1034e275345b65d040cf9f4cf991e3cc99485a8c113ecf6f88d",
    "ferramentas/canon_bridge.py": "715c02927a9c18c7b5e2cb7f119fc9ed2b9effcae99d968f30ca5ffe47d052e0",